{
  "schema_version": 1,
  "written_at": "2026-09-13T20:10:51.177455+00:00",
  "coordinator_error": {
    "error_type": "rpc_failed",
    "message": "unspecified coordinator error",
    "http_status": null
  },
  "payload": {
    "agent_name": "claude_code",
    "session_id": null,
    "summary": "Merged PR #534 with a merge commit rather than the default rebase: the branch carries a merge from resolving a conflict with main, so GitHub refused to rebase it. No open tasks to migrate. Step 5.5 ran for the first time against a real change and correctly reported 'no choices ledger' rather than 'no open choices'.",
    "completed_work": [
      "pre-merge-gate",
      "merge",
      "choices-surfacing",
      "archive",
      "decision-index",
      "branch-cleanup"
    ],
    "in_progress": [],
    "decisions": [
      {
        "title": "Merge commit instead of the default rebase",
        "rationale": "GitHub refused the rebase: the branch contains a merge commit from resolving a docs/decisions conflict after main advanced 258 commits. Of the two remaining options, a merge commit preserves all 39 commits including the 15 fix commits that each name the review finding they close, which is exactly the history the skill's rebase-by-default rationale exists to protect. Squash would have collapsed that record into one commit.",
        "capability": null,
        "supersedes": null
      },
      {
        "title": "No open-task migration needed",
        "rationale": "tasks.md has zero unchecked items, and validation independently verified each checked task maps to shipped code.",
        "capability": null,
        "supersedes": null
      },
      {
        "title": "Six low findings archived unfixed, recorded in the report",
        "rationale": "Non-atomic latest.* pointers, a directory-blind snapshot helper, two over-broad doc assertions, scenario 15's self-referential allowed set, and the RUN_ID_RE widening's effect on prioritize-proposals. None changes behavior; all are named in validation-report.md so they are findable rather than lost.",
        "capability": null,
        "supersedes": null
      }
    ],
    "next_steps": [
      "Six low findings recorded in validation-report.md remain open; none blocks anything."
    ],
    "relevant_files": []
  }
}