{
  "schema_version": 1,
  "written_at": "2026-09-18T12:38:39.039267+00:00",
  "coordinator_error": {
    "error_type": "rpc_failed",
    "message": "unspecified coordinator error",
    "http_status": null
  },
  "payload": {
    "agent_name": "claude_code",
    "session_id": null,
    "summary": "Implemented all 3 phases: threshold config loader (JSON via importlib.resources), decide()'s real live-client body (4 ordered unavailability branches, all returning None/never raising), and an optional event_sink mirroring decide_intent()'s existing one. decide_intent()'s own acquisition step is untouched. 36 tests pass (13 new), ruff and mypy clean on every file this item touched.",
    "completed_work": [
      "packages/system-one-decisions/src/system_one_decisions/config/thresholds.json + _config.py loader",
      "decide()'s real body: 4 ordered branches, lazy import, lru_cache'd client",
      "decide()'s optional event_sink parameter",
      "Fixed a real test-isolation bug in ri-01's test_no_vendor_sdk_imported_at_load_time (subprocess isolation)"
    ],
    "in_progress": [],
    "decisions": [
      {
        "title": "Lazy, cached client construction via functools.lru_cache",
        "rationale": "Preserves ri-01's no-vendor-SDK-import-at-module-load-time guarantee.",
        "capability": "system-one-decisions",
        "supersedes": null
      }
    ],
    "next_steps": [
      "Create PR",
      "Continue the roadmap to ri-03 once merged"
    ],
    "relevant_files": [
      {
        "path": "packages/system-one-decisions/src/system_one_decisions/_core.py",
        "description": "decide()'s real implementation"
      },
      {
        "path": "packages/system-one-decisions/tests/test_decide_live.py",
        "description": "4 unavailability branches + success path"
      },
      {
        "path": "packages/system-one-decisions/tests/test_decide_event_sink.py",
        "description": "event_sink telemetry tests"
      }
    ]
  }
}