{
  "schema_version": 1,
  "written_at": "2026-09-11T03:24:42.772819+00:00",
  "coordinator_error": {
    "error_type": "rpc_failed",
    "message": "unspecified coordinator error",
    "http_status": null
  },
  "payload": {
    "agent_name": "architect",
    "session_id": null,
    "summary": "Re-analysis of the iteration-1 output found one medium finding: task 3.3's Step 5.5 placement was ambiguous because cleanup-feature has two 5c headings and a 5d block before Step 6. Anchored the hook immediately before the Step 6 Archive heading in tasks.md and design F1. Remaining findings are low; loop terminates at threshold with openspec validate --strict green.",
    "completed_work": [
      "[medium] clarity: Step 5.5 placement anchored on the Step 6 heading (tasks 3.3, design F1)"
    ],
    "in_progress": [],
    "decisions": [
      {
        "title": "Anchor cleanup-feature Step 5.5 on the Step 6 heading, not on 5c",
        "rationale": "Duplicate 5c headings and an intervening 5d staged-rollout block make 'after 5c' resolve two ways; 'immediately before ### 6. Archive' resolves one way.",
        "capability": null,
        "supersedes": null
      }
    ],
    "next_steps": [],
    "relevant_files": []
  }
}