{
  "schema_version": 1,
  "written_at": "2026-05-08T17:21:08.871624+00:00",
  "coordinator_error": {
    "error_type": "rpc_failed",
    "message": "HTTP Error 422: Unprocessable Entity",
    "http_status": null
  },
  "payload": {
    "agent_name": "claude_code",
    "session_id": null,
    "summary": "Round 2 of multi-vendor review (post-iteration-2) caught implementation-impossibility issues my self-review missed: a function that doesn't exist (try_emit_audit_event), an enum mismatch with existing data (criticality: blocking vs critical), an unreachable field (synthesis_failed), an unowned manifest field (change_id with no CLI source), stale README content, and missing helper-injection clarification. Fixed all of them. Notable simplification: replaced the nonexistent coordinator audit primitive with Python's standard logging module.",
    "completed_work": [
      "Fixed contracts/finding.schema.json: criticality enum [low, medium, high, critical] (was: blocking) \u2014 matches existing review-findings.schema.json and consensus_synthesizer.py rankings",
      "Made change_id optional in contracts/review-cache-layout.schema.json: removed from required[]; type allows null; description explains CLI dispatcher writes null while in-process callers populate",
      "Dropped ConvergenceResult.synthesis_failed field across spec.md, design.md, tasks.md, proposal.md (3-vendor consensus on unreachability)",
      "Replaced 'audit event' framing with 'structured log entry' in spec.md R4: uses Python logging.error() with extra={} payload, NOT coordination_bridge.try_emit_audit_event() (which doesn't exist)",
      "Added R4.S3 (separate convergence.checkpoint_write_failed log entry) for the silent-failure case where checkpoint write fails before synthesis attempt",
      "Updated R1 to require helper to construct the wire-format envelope (review_type, target, reviewer_vendor wrapper) rather than expecting callers to pre-wrap",
      "Added R1.S6 (quorum_received reflects actual successful vendors, not requested count) and R1.S7 (change_id optional for CLI)",
      "Updated tasks.md task 0.2 to specify the helper signatures including envelope construction; added vendor-name regex verification step",
      "Updated tasks.md task 3.2 to allow narrow try/except around synthesizer.synthesize() for the purpose of logging (not fallback/swallowing)",
      "Updated tasks.md Phase 4 to use Python logging.error() \u2014 no coordinator dependency, no new bridge function",
      "Rewrote contracts/README.md to remove all stale 'fallback' / 'subprocess' / 'fallback_recovered' / 'fallback_failed' references and reflect the new framing",
      "Updated design.md D5: Python logging instead of coordinator audit. Updated component-interaction diagrams to show logger.error() instead of try_emit_audit_event()",
      "Updated proposal.md What Changes section to drop synthesis_failed; added context on why structured logs instead of coordinator audit",
      "Re-validated: openspec --strict passes, work-packages validates, JSON schemas parse"
    ],
    "in_progress": [],
    "decisions": [
      {
        "title": "Use Python logging.error() instead of nonexistent coordinator audit primitive",
        "rationale": "Gemini round-2 finding #1 verified: try_emit_audit_event doesn't exist in coordination_bridge; POST /audit/log doesn't exist on the agent-coordinator API. Adding both would substantially expand scope. Python's logging module with structured payload (extra={...}) is sufficient for chronic-failure detection by log-aggregation tools.",
        "capability": "multi-vendor-review",
        "supersedes": null
      },
      {
        "title": "Drop ConvergenceResult.synthesis_failed field",
        "rationale": "Three-vendor consensus (codex r2 #4, gemini r2 #3, claude r2 #2) caught that the field is unreachable: when synthesis raises, the exception propagates and no ConvergenceResult is constructed. A boolean only set in a partial-result path none of our callers actually use was over-engineering driven by the original auto-recovery framing.",
        "capability": "multi-vendor-review",
        "supersedes": null
      },
      {
        "title": "Make change_id optional in manifest schema",
        "rationale": "Codex r2 #2 + gemini r2 #2 caught: the existing review_dispatcher.py CLI has no change_id concept (uses hardcoded target='cli-dispatch'). Adding a CLI argument expands scope; making the field optional in the schema lets the dispatcher continue working as-is while in-process callers populate it.",
        "capability": "multi-vendor-review",
        "supersedes": null
      },
      {
        "title": "Fix criticality enum: blocking -> critical",
        "rationale": "Codex r2 #1 caught and grep verified: existing review-findings.schema.json uses [low, medium, high, critical] and consensus_synthesizer.py's _higher_criticality() ranks accordingly. My finding.schema.json had [low, medium, high, blocking], which would have rejected every existing valid finding.",
        "capability": "multi-vendor-review",
        "supersedes": null
      },
      {
        "title": "Helper centralizes wire-format envelope construction",
        "rationale": "Gemini r2 #5 caught that ReviewOrchestrator returns raw findings, not the wrapper object. Putting envelope construction in checkpoint_findings.write_vendor_findings() rather than in callers keeps the wire-format contract centralized and prevents future callers from accidentally writing raw arrays (the original mistake my own findings file made).",
        "capability": "multi-vendor-review",
        "supersedes": null
      },
      {
        "title": "Add convergence.checkpoint_write_failed log event for the silent-failure case",
        "rationale": "My own claude-r2-003: if the checkpoint write itself fails (OSError before synthesis), there's no observability beyond the bare exception. Adding a second log event closes that gap symmetrically with the synthesis-failure case.",
        "capability": "multi-vendor-review",
        "supersedes": null
      }
    ],
    "next_steps": [],
    "relevant_files": []
  }
}