{
  "schema_version": 1,
  "written_at": "2026-09-14T01:56:09.814200+00:00",
  "coordinator_error": {
    "error_type": "rpc_failed",
    "message": "unspecified coordinator error",
    "http_status": null
  },
  "payload": {
    "agent_name": "grok",
    "session_id": null,
    "summary": "Gate 2 approved Approach A plan. Coordinator task seeding attempted. Ready for /implement-feature.",
    "completed_work": [
      "gate-2-approved",
      "task-seeding"
    ],
    "in_progress": [],
    "decisions": [
      {
        "title": "Gate 2 approve plan",
        "rationale": "User approved complete plan; proceed to implementation.",
        "capability": "skill-workflow",
        "supersedes": null
      }
    ],
    "next_steps": [
      "/implement-feature retire-skill-literal-model-hints"
    ],
    "relevant_files": []
  }
}