{
  "schema_version": 1,
  "written_at": "2026-09-02T01:33:01.664003+00:00",
  "coordinator_error": {
    "error_type": "rpc_failed",
    "message": "unspecified coordinator error",
    "http_status": null
  },
  "payload": {
    "agent_name": "codex",
    "session_id": "impl-review-round-3",
    "summary": "Final maximum implementation-review round converged: primary Codex and Antigravity supplied schema-valid 2/2 quorum with zero blocking findings and zero disagreements.",
    "completed_work": [
      "Reviewed the whole branch with special focus on diff 322efa22..866c4e69.",
      "Confirmed policy-origin category maps realistic prefixed denials to 403 without misclassifying guardrail, validation, or RPC failures.",
      "Dispatched Antigravity only; it returned four schema-valid positive findings in 47.9 seconds.",
      "Recorded schema-valid primary findings, vendor findings, manifest, and 2/2 consensus with blocking_count=0."
    ],
    "in_progress": [],
    "decisions": [
      {
        "title": "Outcome is converged at the maximum round",
        "rationale": "Two independent reviewers confirmed the explicit policy-origin remediation and found no blocking or disagreement evidence.",
        "capability": null,
        "supersedes": null
      }
    ],
    "next_steps": [
      "Advance autopilot from IMPL_REVIEW to VALIDATE."
    ],
    "relevant_files": [
      {
        "path": "openspec/changes/implement-idempotent-queue-submission-and-outbox-ordering/reviews/implementation/round-3/consensus-implementation.json",
        "description": "Final 2/2 converged consensus"
      },
      {
        "path": "agent-coordinator/src/work_queue.py",
        "description": "Service-owned policy failure provenance"
      },
      {
        "path": "agent-coordinator/src/coordination_api.py",
        "description": "RFC 7807 projection failure mapping"
      }
    ]
  }
}